Product,ActionSet,Action,Action_Describe,Action_Link,Node_Name
SAS Visual Analytics,accessControl,accessPersonalCaslibs,Provides administrative access to all personal caslibs (CASUSER and CASUSERHDFS),http://documentation.sas.com/?cdcId=pgmsascdc&cdcVersion=9.4_3.5&docsetId=caspg&docsetTarget=cas-accesscontrol-accesspersonalcaslibs.htm&locale=en,A_accessPersonalCaslibs1
SAS Visual Analytics,accessControl,assumeRole,Assumes a role,http://documentation.sas.com/?cdcId=pgmsascdc&cdcVersion=9.4_3.5&docsetId=caspg&docsetTarget=cas-accesscontrol-assumerole.htm&locale=en,A_assumeRole2
SAS Visual Analytics,accessControl,checkInAllObjects,Releases all objects that are checked out. Use this action if the current client session does not have a transaction,http://documentation.sas.com/?cdcId=pgmsascdc&cdcVersion=9.4_3.5&docsetId=caspg&docsetTarget=cas-accesscontrol-checkinallobjects.htm&locale=en,A_checkInAllObjects2
SAS Visual Analytics,accessControl,checkOutObject,Reserves an object (and all of its children) for update by only the current client session. Prevents an object (and all of its parents) from being checked out exclusively by another session if checkOutType=Shared,http://documentation.sas.com/?cdcId=pgmsascdc&cdcVersion=9.4_3.5&docsetId=caspg&docsetTarget=cas-accesscontrol-checkoutobject.htm&locale=en,A_checkOutObject1
SAS Visual Analytics,accessControl,commitTransaction,"Persists all changes in an access control transaction to the server, releases all checked-out objects, and terminates the transaction",http://documentation.sas.com/?cdcId=pgmsascdc&cdcVersion=9.4_3.5&docsetId=caspg&docsetTarget=cas-accesscontrol-committransaction.htm&locale=en,A_commitTransaction2
SAS Visual Analytics,accessControl,completeBackup,Flags a backup as complete,http://documentation.sas.com/?cdcId=pgmsascdc&cdcVersion=9.4_3.5&docsetId=caspg&docsetTarget=cas-accesscontrol-completebackup.htm&locale=en,A_completeBackup0
SAS Visual Analytics,accessControl,createBackup,Creates a backup if one is not in progress,http://documentation.sas.com/?cdcId=pgmsascdc&cdcVersion=9.4_3.5&docsetId=caspg&docsetTarget=cas-accesscontrol-createbackup.htm&locale=en,A_createBackup0
SAS Visual Analytics,accessControl,deleteBWList,Deletes a blacklist or a whitelist,http://documentation.sas.com/?cdcId=pgmsascdc&cdcVersion=9.4_3.5&docsetId=caspg&docsetTarget=cas-accesscontrol-deletebwlist.htm&locale=en,A_deleteBWList2
SAS Visual Analytics,accessControl,dropRole,Relinquishes a role,http://documentation.sas.com/?cdcId=pgmsascdc&cdcVersion=9.4_3.5&docsetId=caspg&docsetTarget=cas-accesscontrol-droprole.htm&locale=en,A_dropRole2
SAS Visual Analytics,accessControl,isAuthorized,Shows whether access is authorized,http://documentation.sas.com/?cdcId=pgmsascdc&cdcVersion=9.4_3.5&docsetId=caspg&docsetTarget=cas-accesscontrol-isauthorized.htm&locale=en,A_isAuthorized2
SAS Visual Analytics,accessControl,isAuthorizedActions,Shows whether access is authorized to actions,http://documentation.sas.com/?cdcId=pgmsascdc&cdcVersion=9.4_3.5&docsetId=caspg&docsetTarget=cas-accesscontrol-isauthorizedactions.htm&locale=en,A_isAuthorizedActions2
SAS Visual Analytics,accessControl,isAuthorizedColumns,Shows whether access is authorized to columns,http://documentation.sas.com/?cdcId=pgmsascdc&cdcVersion=9.4_3.5&docsetId=caspg&docsetTarget=cas-accesscontrol-isauthorizedcolumns.htm&locale=en,A_isAuthorizedColumns0
SAS Visual Analytics,accessControl,isAuthorizedTables,Shows whether access is authorized to tables,http://documentation.sas.com/?cdcId=pgmsascdc&cdcVersion=9.4_3.5&docsetId=caspg&docsetTarget=cas-accesscontrol-isauthorizedtables.htm&locale=en,A_isAuthorizedTables1
SAS Visual Analytics,accessControl,isInRole,Shows whether a role is assumed,http://documentation.sas.com/?cdcId=pgmsascdc&cdcVersion=9.4_3.5&docsetId=caspg&docsetTarget=cas-accesscontrol-isinrole.htm&locale=en,A_isInRole2
SAS Visual Analytics,accessControl,listAcsActionSet,Lists access controls for an action or action set,http://documentation.sas.com/?cdcId=pgmsascdc&cdcVersion=9.4_3.5&docsetId=caspg&docsetTarget=cas-accesscontrol-listacsactionset.htm&locale=en,A_listAcsActionSet0
SAS Visual Analytics,accessControl,listAcsData,"Lists access controls for caslibs, tables, and columns",http://documentation.sas.com/?cdcId=pgmsascdc&cdcVersion=9.4_3.5&docsetId=caspg&docsetTarget=cas-accesscontrol-listacsdata.htm&locale=en,A_listAcsData0
SAS Visual Analytics,accessControl,listAllPrincipals,Lists all principals that have explicit access controls,http://documentation.sas.com/?cdcId=pgmsascdc&cdcVersion=9.4_3.5&docsetId=caspg&docsetTarget=cas-accesscontrol-listallprincipals.htm&locale=en,A_listAllPrincipals1
SAS Visual Analytics,accessControl,listMetadata,"Lists the metadata for caslibs, tables, columns, action sets, actions, or administrators",http://documentation.sas.com/?cdcId=pgmsascdc&cdcVersion=9.4_3.5&docsetId=caspg&docsetTarget=cas-accesscontrol-listmetadata.htm&locale=en,A_listMetadata2
SAS Visual Analytics,accessControl,operActionMd,"Adds, deletes, and modifies action metadata",http://documentation.sas.com/?cdcId=pgmsascdc&cdcVersion=9.4_3.5&docsetId=caspg&docsetTarget=cas-accesscontrol-operactionmd.htm&locale=en,A_operActionMd1
SAS Visual Analytics,accessControl,operActionSetMd,"Adds, deletes, and modifies action set metadata",http://documentation.sas.com/?cdcId=pgmsascdc&cdcVersion=9.4_3.5&docsetId=caspg&docsetTarget=cas-accesscontrol-operactionsetmd.htm&locale=en,A_operActionSetMd0
SAS Visual Analytics,accessControl,operAdminMd,Assigns users and groups to roles and modifies administrator metadata,http://documentation.sas.com/?cdcId=pgmsascdc&cdcVersion=9.4_3.5&docsetId=caspg&docsetTarget=cas-accesscontrol-operadminmd.htm&locale=en,A_operAdminMd0
SAS Visual Analytics,accessControl,operBWPaths,Configures a blacklist or whitelist of paths,http://documentation.sas.com/?cdcId=pgmsascdc&cdcVersion=9.4_3.5&docsetId=caspg&docsetTarget=cas-accesscontrol-operbwpaths.htm&locale=en,A_operBWPaths0
SAS Visual Analytics,accessControl,operColumnMd,"Adds, deletes, and modifies column metadata",http://documentation.sas.com/?cdcId=pgmsascdc&cdcVersion=9.4_3.5&docsetId=caspg&docsetTarget=cas-accesscontrol-opercolumnmd.htm&locale=en,A_operColumnMd2
SAS Visual Analytics,accessControl,operTableMd,"Adds, deletes, and modifies table metadata",http://documentation.sas.com/?cdcId=pgmsascdc&cdcVersion=9.4_3.5&docsetId=caspg&docsetTarget=cas-accesscontrol-opertablemd.htm&locale=en,A_operTableMd1
SAS Visual Analytics,accessControl,remAllAcsActionSet,Removes all access controls for an action set or action,http://documentation.sas.com/?cdcId=pgmsascdc&cdcVersion=9.4_3.5&docsetId=caspg&docsetTarget=cas-accesscontrol-remallacsactionset.htm&locale=en,A_remAllAcsActionSet0
SAS Visual Analytics,accessControl,remAllAcsData,"Removes all access controls for a caslib, table, or column",http://documentation.sas.com/?cdcId=pgmsascdc&cdcVersion=9.4_3.5&docsetId=caspg&docsetTarget=cas-accesscontrol-remallacsdata.htm&locale=en,A_remAllAcsData0
SAS Visual Analytics,accessControl,repAllAcsAction,Replaces all access controls for an action,http://documentation.sas.com/?cdcId=pgmsascdc&cdcVersion=9.4_3.5&docsetId=caspg&docsetTarget=cas-accesscontrol-repallacsaction.htm&locale=en,A_repAllAcsAction1
SAS Visual Analytics,accessControl,repAllAcsActionSet,Replaces all access controls for an action set,http://documentation.sas.com/?cdcId=pgmsascdc&cdcVersion=9.4_3.5&docsetId=caspg&docsetTarget=cas-accesscontrol-repallacsactionset.htm&locale=en,A_repAllAcsActionSet1
SAS Visual Analytics,accessControl,repAllAcsCaslib,Replaces all access controls for a caslib,http://documentation.sas.com/?cdcId=pgmsascdc&cdcVersion=9.4_3.5&docsetId=caspg&docsetTarget=cas-accesscontrol-repallacscaslib.htm&locale=en,A_repAllAcsCaslib0
SAS Visual Analytics,accessControl,repAllAcsColumn,Replaces all access controls for a column,http://documentation.sas.com/?cdcId=pgmsascdc&cdcVersion=9.4_3.5&docsetId=caspg&docsetTarget=cas-accesscontrol-repallacscolumn.htm&locale=en,A_repAllAcsColumn0
SAS Visual Analytics,accessControl,repAllAcsTable,Replaces all access controls for a table,http://documentation.sas.com/?cdcId=pgmsascdc&cdcVersion=9.4_3.5&docsetId=caspg&docsetTarget=cas-accesscontrol-repallacstable.htm&locale=en,A_repAllAcsTable0
SAS Visual Analytics,accessControl,rollbackTransaction,"Discards all changes in an access control transaction, releases all checked-out objects, and terminates the transaction",http://documentation.sas.com/?cdcId=pgmsascdc&cdcVersion=9.4_3.5&docsetId=caspg&docsetTarget=cas-accesscontrol-rollbacktransaction.htm&locale=en,A_rollbackTransaction1
SAS Visual Analytics,accessControl,showRolesAllowed,Shows the roles that a user is a member of,http://documentation.sas.com/?cdcId=pgmsascdc&cdcVersion=9.4_3.5&docsetId=caspg&docsetTarget=cas-accesscontrol-showrolesallowed.htm&locale=en,A_showRolesAllowed0
SAS Visual Analytics,accessControl,showRolesIn,Shows the currently active role,http://documentation.sas.com/?cdcId=pgmsascdc&cdcVersion=9.4_3.5&docsetId=caspg&docsetTarget=cas-accesscontrol-showrolesin.htm&locale=en,A_showRolesIn0
SAS Visual Analytics,accessControl,startTransaction,"Initiates an access control transaction in the current client session. Within a transaction, changes are private. Within a transaction, only exclusively reserved (checked-out) objects and their children can be updated. A transaction terminates when it is committed or rolled back",http://documentation.sas.com/?cdcId=pgmsascdc&cdcVersion=9.4_3.5&docsetId=caspg&docsetTarget=cas-accesscontrol-starttransaction.htm&locale=en,A_startTransaction2
SAS Visual Analytics,accessControl,statusTransaction,Shows whether client session has an active transaction,http://documentation.sas.com/?cdcId=pgmsascdc&cdcVersion=9.4_3.5&docsetId=caspg&docsetTarget=cas-accesscontrol-statustransaction.htm&locale=en,A_statusTransaction2
SAS Visual Analytics,accessControl,updSomeAcsAction,"Adds, deletes, and modifies some access controls for an action",http://documentation.sas.com/?cdcId=pgmsascdc&cdcVersion=9.4_3.5&docsetId=caspg&docsetTarget=cas-accesscontrol-updsomeacsaction.htm&locale=en,A_updSomeAcsAction2
SAS Visual Analytics,accessControl,updSomeAcsActionSet,"Adds, deletes, and modifies some access controls for an action set",http://documentation.sas.com/?cdcId=pgmsascdc&cdcVersion=9.4_3.5&docsetId=caspg&docsetTarget=cas-accesscontrol-updsomeacsactionset.htm&locale=en,A_updSomeAcsActionSet1
SAS Visual Analytics,accessControl,updSomeAcsCaslib,"Adds, deletes, and modifies some access controls for a caslib",http://documentation.sas.com/?cdcId=pgmsascdc&cdcVersion=9.4_3.5&docsetId=caspg&docsetTarget=cas-accesscontrol-updsomeacscaslib.htm&locale=en,A_updSomeAcsCaslib0
SAS Visual Analytics,accessControl,updSomeAcsColumn,"Adds, deletes, and modifies some access controls for a column",http://documentation.sas.com/?cdcId=pgmsascdc&cdcVersion=9.4_3.5&docsetId=caspg&docsetTarget=cas-accesscontrol-updsomeacscolumn.htm&locale=en,A_updSomeAcsColumn2
SAS Visual Analytics,accessControl,updSomeAcsTable,"Adds, deletes, and modifies some access controls for a table",http://documentation.sas.com/?cdcId=pgmsascdc&cdcVersion=9.4_3.5&docsetId=caspg&docsetTarget=cas-accesscontrol-updsomeacstable.htm&locale=en,A_updSomeAcsTable0
SAS Visual Analytics,accessControl,whatCheckoutsExist,"Lists checkouts held on an object, its parents, and optionally its children",http://documentation.sas.com/?cdcId=pgmsascdc&cdcVersion=9.4_3.5&docsetId=caspg&docsetTarget=cas-accesscontrol-whatcheckoutsexist.htm&locale=en,A_whatCheckoutsExist2
SAS Visual Analytics,accessControl,whatIsEffective,Lists effective access and explanations (Origins),http://documentation.sas.com/?cdcId=pgmsascdc&cdcVersion=9.4_3.5&docsetId=caspg&docsetTarget=cas-accesscontrol-whatiseffective.htm&locale=en,A_whatIsEffective2
SAS Visual Analytics,aggregation,aggregate,Performs aggregation on selected variables,http://documentation.sas.com/?cdcId=pgmsascdc&cdcVersion=9.4_3.5&docsetId=casanpg&docsetTarget=cas-aggregation-aggregate.htm&locale=en,A_aggregate0
SAS Visual Analytics,aStore,describe,Describes some of the contents of the analytic store,http://documentation.sas.com/?cdcId=pgmsascdc&cdcVersion=9.4_3.5&docsetId=casactml&docsetTarget=cas-astore-describe.htm&locale=en,A_describe1
SAS Visual Analytics,aStore,download,Downloads a remote store to a local store,http://documentation.sas.com/?cdcId=pgmsascdc&cdcVersion=9.4_3.5&docsetId=casactml&docsetTarget=cas-astore-download.htm&locale=en,A_download0
SAS Visual Analytics,aStore,score,Uses an analytic store to score an input table,http://documentation.sas.com/?cdcId=pgmsascdc&cdcVersion=9.4_3.5&docsetId=casactml&docsetTarget=cas-astore-score.htm&locale=en,A_score1
SAS Visual Analytics,aStore,upload,Uploads a local store to a remote store,http://documentation.sas.com/?cdcId=pgmsascdc&cdcVersion=9.4_3.5&docsetId=casactml&docsetTarget=cas-astore-upload.htm&locale=en,A_upload0
SAS Visual Analytics,builtins,actionSetFromTable,Restores a user-defined action set from a saved table,http://documentation.sas.com/?cdcId=pgmsascdc&cdcVersion=9.4_3.5&docsetId=caspg&docsetTarget=cas-builtins-actionsetfromtable.htm&locale=en,A_actionSetFromTable0
SAS Visual Analytics,builtins,actionSetInfo,Shows the build information from loaded action sets,http://documentation.sas.com/?cdcId=pgmsascdc&cdcVersion=9.4_3.5&docsetId=caspg&docsetTarget=cas-builtins-actionsetinfo.htm&locale=en,A_actionSetInfo2
SAS Visual Analytics,builtins,actionSetToTable,Makes an in-memory table from a user-defined action set,http://documentation.sas.com/?cdcId=pgmsascdc&cdcVersion=9.4_3.5&docsetId=caspg&docsetTarget=cas-builtins-actionsettotable.htm&locale=en,A_actionSetToTable1
SAS Visual Analytics,builtins,addNode,Adds a machine to the server,http://documentation.sas.com/?cdcId=pgmsascdc&cdcVersion=9.4_3.5&docsetId=caspg&docsetTarget=cas-builtins-addnode.htm&locale=en,A_addNode2
SAS Visual Analytics,builtins,defineActionSet,Defines a new user-defined action set,http://documentation.sas.com/?cdcId=pgmsascdc&cdcVersion=9.4_3.5&docsetId=caspg&docsetTarget=cas-builtins-defineactionset.htm&locale=en,A_defineActionSet2
SAS Visual Analytics,builtins,describeActionSet,Describes a user-defined action set,http://documentation.sas.com/?cdcId=pgmsascdc&cdcVersion=9.4_3.5&docsetId=caspg&docsetTarget=cas-builtins-describeactionset.htm&locale=en,A_describeActionSet0
SAS Visual Analytics,builtins,dropActionSet,Drops a user-defined action set,http://documentation.sas.com/?cdcId=pgmsascdc&cdcVersion=9.4_3.5&docsetId=caspg&docsetTarget=cas-builtins-dropactionset.htm&locale=en,A_dropActionSet0
SAS Visual Analytics,builtins,echo,Prints the supplied parameters to the client log,http://documentation.sas.com/?cdcId=pgmsascdc&cdcVersion=9.4_3.5&docsetId=caspg&docsetTarget=cas-builtins-echo.htm&locale=en,A_echo2
SAS Visual Analytics,builtins,getCacheInfo,Retrieves info about CAS_DISK_CACHE usage on session worker nodes,http://documentation.sas.com/?cdcId=pgmsascdc&cdcVersion=9.4_3.5&docsetId=caspg&docsetTarget=cas-builtins-getcacheinfo.htm&locale=en,A_getCacheInfo1
SAS Visual Analytics,builtins,getLicenseInfo,Shows the license information for a SAS product,http://documentation.sas.com/?cdcId=pgmsascdc&cdcVersion=9.4_3.5&docsetId=caspg&docsetTarget=cas-builtins-getlicenseinfo.htm&locale=en,A_getLicenseInfo0
SAS Visual Analytics,builtins,getLicensedProductInfo,Shows the information for licensed SAS products,http://documentation.sas.com/?cdcId=pgmsascdc&cdcVersion=9.4_3.5&docsetId=caspg&docsetTarget=cas-builtins-getlicensedproductinfo.htm&locale=en,A_getLicensedProductInfo0
SAS Visual Analytics,builtins,help,Shows the parameters for an action or lists all available actions,http://documentation.sas.com/?cdcId=pgmsascdc&cdcVersion=9.4_3.5&docsetId=caspg&docsetTarget=cas-builtins-help.htm&locale=en,A_help0
SAS Visual Analytics,builtins,history,Shows the actions that were run in this session,http://documentation.sas.com/?cdcId=pgmsascdc&cdcVersion=9.4_3.5&docsetId=caspg&docsetTarget=cas-builtins-history.htm&locale=en,A_history0
SAS Visual Analytics,builtins,httpAddress,Shows the HTTP address for the server monitor,http://documentation.sas.com/?cdcId=pgmsascdc&cdcVersion=9.4_3.5&docsetId=caspg&docsetTarget=cas-builtins-httpaddress.htm&locale=en,A_httpAddress0
SAS Visual Analytics,builtins,installActionSet,Loads an action set in new sessions automatically,http://documentation.sas.com/?cdcId=pgmsascdc&cdcVersion=9.4_3.5&docsetId=caspg&docsetTarget=cas-builtins-installactionset.htm&locale=en,A_installActionSet0
SAS Visual Analytics,builtins,listNodes,Shows the host names used by the server,http://documentation.sas.com/?cdcId=pgmsascdc&cdcVersion=9.4_3.5&docsetId=caspg&docsetTarget=cas-builtins-listnodes.htm&locale=en,A_listNodes0
SAS Visual Analytics,builtins,loadActionSet,Loads an action set for use in this session,http://documentation.sas.com/?cdcId=pgmsascdc&cdcVersion=9.4_3.5&docsetId=caspg&docsetTarget=cas-builtins-loadactionset.htm&locale=en,A_loadActionSet0
SAS Visual Analytics,builtins,log,Shows and modifies logging levels,http://documentation.sas.com/?cdcId=pgmsascdc&cdcVersion=9.4_3.5&docsetId=caspg&docsetTarget=cas-builtins-log.htm&locale=en,A_log0
SAS Visual Analytics,builtins,modifyQueue,Modifies the action response queue settings,http://documentation.sas.com/?cdcId=pgmsascdc&cdcVersion=9.4_3.5&docsetId=caspg&docsetTarget=cas-builtins-modifyqueue.htm&locale=en,A_modifyQueue1
SAS Visual Analytics,builtins,ping,Sends a single request to the server to confirm that the connection is working,http://documentation.sas.com/?cdcId=pgmsascdc&cdcVersion=9.4_3.5&docsetId=caspg&docsetTarget=cas-builtins-ping.htm&locale=en,A_ping1
SAS Visual Analytics,builtins,queryActionSet,Shows whether an action set is loaded,http://documentation.sas.com/?cdcId=pgmsascdc&cdcVersion=9.4_3.5&docsetId=caspg&docsetTarget=cas-builtins-queryactionset.htm&locale=en,A_queryActionSet0
SAS Visual Analytics,builtins,queryName,Checks whether a name is an action or action set name,http://documentation.sas.com/?cdcId=pgmsascdc&cdcVersion=9.4_3.5&docsetId=caspg&docsetTarget=cas-builtins-queryname.htm&locale=en,A_queryName0
SAS Visual Analytics,builtins,reflect,Shows detailed parameter information for an action or all actions in an action set,http://documentation.sas.com/?cdcId=pgmsascdc&cdcVersion=9.4_3.5&docsetId=caspg&docsetTarget=cas-builtins-reflect.htm&locale=en,A_reflect2
SAS Visual Analytics,builtins,refreshLicense,Refresh SAS license information from a file,http://documentation.sas.com/?cdcId=pgmsascdc&cdcVersion=9.4_3.5&docsetId=caspg&docsetTarget=cas-builtins-refreshlicense.htm&locale=en,A_refreshLicense0
SAS Visual Analytics,builtins,removeNode,Remove one or more machines from the server,http://documentation.sas.com/?cdcId=pgmsascdc&cdcVersion=9.4_3.5&docsetId=caspg&docsetTarget=cas-builtins-removenode.htm&locale=en,A_removeNode0
SAS Visual Analytics,builtins,serverStatus (about),Shows the status of the server,http://documentation.sas.com/?cdcId=pgmsascdc&cdcVersion=9.4_3.5&docsetId=caspg&docsetTarget=cas-builtins-serverstatus.htm&locale=en,A_serverStatus (about)0
SAS Visual Analytics,builtins,shutdown,Shuts down the server,http://documentation.sas.com/?cdcId=pgmsascdc&cdcVersion=9.4_3.5&docsetId=caspg&docsetTarget=cas-builtins-shutdown.htm&locale=en,A_shutdown0
SAS Visual Analytics,builtins,userInfo,Shows the user information for your connection,http://documentation.sas.com/?cdcId=pgmsascdc&cdcVersion=9.4_3.5&docsetId=caspg&docsetTarget=cas-builtins-userinfo.htm&locale=en,A_userInfo1
SAS Visual Analytics,sccasl,runCasl,Runs CASL code,http://documentation.sas.com/?cdcId=pgmsascdc&cdcVersion=9.4_3.5&docsetId=caspg&docsetTarget=cas-sccasl-runcasl.htm&locale=en,A_runCasl1
SAS Visual Analytics,dataPreprocess,binning,Performs unsupervised variable discretization,http://documentation.sas.com/?cdcId=pgmsascdc&cdcVersion=9.4_3.5&docsetId=casanpg&docsetTarget=cas-datapreprocess-binning.htm&locale=en,A_binning2
SAS Visual Analytics,dataPreprocess,catTrans,Groups and encodes categorical variables using unsupervised and supervised grouping techniques,http://documentation.sas.com/?cdcId=pgmsascdc&cdcVersion=9.4_3.5&docsetId=casanpg&docsetTarget=cas-datapreprocess-cattrans.htm&locale=en,A_catTrans0
SAS Visual Analytics,dataPreprocess,discretize,Performs supervised and unsupervised variable discretization,http://documentation.sas.com/?cdcId=pgmsascdc&cdcVersion=9.4_3.5&docsetId=casanpg&docsetTarget=cas-datapreprocess-discretize.htm&locale=en,A_discretize0
SAS Visual Analytics,dataPreprocess,highCardinality,Performs randomized cardinality estimation,http://documentation.sas.com/?cdcId=pgmsascdc&cdcVersion=9.4_3.5&docsetId=casanpg&docsetTarget=cas-datapreprocess-highcardinality.htm&locale=en,A_highCardinality0
SAS Visual Analytics,dataPreprocess,histogram,Generates histogram bins and simple bin-based statistics for numeric variables,http://documentation.sas.com/?cdcId=pgmsascdc&cdcVersion=9.4_3.5&docsetId=casanpg&docsetTarget=cas-datapreprocess-histogram.htm&locale=en,A_histogram0
SAS Visual Analytics,dataPreprocess,impute,Performs data matrix (variable) imputation,http://documentation.sas.com/?cdcId=pgmsascdc&cdcVersion=9.4_3.5&docsetId=casanpg&docsetTarget=cas-datapreprocess-impute.htm&locale=en,A_impute2
SAS Visual Analytics,dataPreprocess,kde,Computes kernel density estimation,http://documentation.sas.com/?cdcId=pgmsascdc&cdcVersion=9.4_3.5&docsetId=casanpg&docsetTarget=cas-datapreprocess-kde.htm&locale=en,A_kde1
SAS Visual Analytics,dataPreprocess,outlier,Performs outlier detection and treatment,http://documentation.sas.com/?cdcId=pgmsascdc&cdcVersion=9.4_3.5&docsetId=casanpg&docsetTarget=cas-datapreprocess-outlier.htm&locale=en,A_outlier2
SAS Visual Analytics,dataPreprocess,rustats,"Computes robust univariate statistics, centralized moments, quantiles, and frequency distribution statistics",http://documentation.sas.com/?cdcId=pgmsascdc&cdcVersion=9.4_3.5&docsetId=casanpg&docsetTarget=cas-datapreprocess-rustats.htm&locale=en,A_rustats0
SAS Visual Analytics,dataPreprocess,transform,"Performs pipelined variable imputation, outlier detection and treatment, functional transformation, binning, and robust univariate statistics to evaluate the quality of the transformation",http://documentation.sas.com/?cdcId=pgmsascdc&cdcVersion=9.4_3.5&docsetId=casanpg&docsetTarget=cas-datapreprocess-transform.htm&locale=en,A_transform1
SAS Visual Analytics,dataStep,runCode,Runs DATA step code,http://documentation.sas.com/?cdcId=pgmsascdc&cdcVersion=9.4_3.5&docsetId=caspg&docsetTarget=cas-datastep-runcode.htm&locale=en,A_runCode2
SAS Visual Analytics,dataStep,runCodeTable,Runs DATA step code stored in a CAS table,http://documentation.sas.com/?cdcId=pgmsascdc&cdcVersion=9.4_3.5&docsetId=caspg&docsetTarget=cas-datastep-runcodetable.htm&locale=en,A_runCodeTable0
SAS Visual Analytics,decisionTree,dtreeCode,Generates DATA step scoring code from a decision tree model,http://documentation.sas.com/?cdcId=pgmsascdc&cdcVersion=9.4_3.5&docsetId=casanpg&docsetTarget=cas-decisiontree-dtreecode.htm&locale=en,A_dtreeCode0
SAS Visual Analytics,decisionTree,dtreeExportModel,Export the aStore model for a tree model table,http://documentation.sas.com/?cdcId=pgmsascdc&cdcVersion=9.4_3.5&docsetId=casanpg&docsetTarget=cas-decisiontree-dtreeexportmodel.htm&locale=en,A_dtreeExportModel1
SAS Visual Analytics,decisionTree,dtreeMerge,Merges decision tree nodes,http://documentation.sas.com/?cdcId=pgmsascdc&cdcVersion=9.4_3.5&docsetId=casanpg&docsetTarget=cas-decisiontree-dtreemerge.htm&locale=en,A_dtreeMerge0
SAS Visual Analytics,decisionTree,dtreePrune,Prune a decision tree,http://documentation.sas.com/?cdcId=pgmsascdc&cdcVersion=9.4_3.5&docsetId=casanpg&docsetTarget=cas-decisiontree-dtreeprune.htm&locale=en,A_dtreePrune1
SAS Visual Analytics,decisionTree,dtreeScore,Scores a table using a decision tree model,http://documentation.sas.com/?cdcId=pgmsascdc&cdcVersion=9.4_3.5&docsetId=casanpg&docsetTarget=cas-decisiontree-dtreescore.htm&locale=en,A_dtreeScore0
SAS Visual Analytics,decisionTree,dtreeSplit,Splits decision tree nodes,http://documentation.sas.com/?cdcId=pgmsascdc&cdcVersion=9.4_3.5&docsetId=casanpg&docsetTarget=cas-decisiontree-dtreesplit.htm&locale=en,A_dtreeSplit1
SAS Visual Analytics,decisionTree,dtreeTrain,Trains a decision tree,http://documentation.sas.com/?cdcId=pgmsascdc&cdcVersion=9.4_3.5&docsetId=casanpg&docsetTarget=cas-decisiontree-dtreetrain.htm&locale=en,A_dtreeTrain1
SAS Visual Analytics,decisionTree,forestCode,Generates DATA step scoring code from a forest model,http://documentation.sas.com/?cdcId=pgmsascdc&cdcVersion=9.4_3.5&docsetId=casanpg&docsetTarget=cas-decisiontree-forestcode.htm&locale=en,A_forestCode0
SAS Visual Analytics,decisionTree,forestScore,Scores a table using a forest model,http://documentation.sas.com/?cdcId=pgmsascdc&cdcVersion=9.4_3.5&docsetId=casanpg&docsetTarget=cas-decisiontree-forestscore.htm&locale=en,A_forestScore1
SAS Visual Analytics,decisionTree,forestTrain,Trains a forest. This action requires a SAS Visual Data Mining and Machine Learning license,http://documentation.sas.com/?cdcId=pgmsascdc&cdcVersion=9.4_3.5&docsetId=casanpg&docsetTarget=cas-decisiontree-foresttrain.htm&locale=en,A_forestTrain0
SAS Visual Analytics,decisionTree,gbtreeCode,Generates DATA step scoring code from a gradient boosting tree model,http://documentation.sas.com/?cdcId=pgmsascdc&cdcVersion=9.4_3.5&docsetId=casanpg&docsetTarget=cas-decisiontree-gbtreecode.htm&locale=en,A_gbtreeCode1
SAS Visual Analytics,decisionTree,gbtreeScore,Scores a table using a gradient boosting tree model,http://documentation.sas.com/?cdcId=pgmsascdc&cdcVersion=9.4_3.5&docsetId=casanpg&docsetTarget=cas-decisiontree-gbtreescore.htm&locale=en,A_gbtreeScore2
