Product,ActionSet,Action,Action_Describe,Action_Link,Node_Name
SAS Visual Analytics,table,fetch,Fetches rows from a table or view,http://documentation.sas.com/?cdcId=pgmsascdc&cdcVersion=9.4_3.5&docsetId=caspg&docsetTarget=cas-table-fetch.htm&locale=en,A_fetch0
SAS Visual Analytics,table,fileInfo,Lists the files in a caslib's data source,http://documentation.sas.com/?cdcId=pgmsascdc&cdcVersion=9.4_3.5&docsetId=caspg&docsetTarget=cas-table-fileinfo.htm&locale=en,A_fileInfo2
SAS Visual Analytics,table,index,Create indexes on one or more table variables,http://documentation.sas.com/?cdcId=pgmsascdc&cdcVersion=9.4_3.5&docsetId=caspg&docsetTarget=cas-table-index.htm&locale=en,A_index1
SAS Visual Analytics,table,loadDataSource,Loads one or more data source interfaces,http://documentation.sas.com/?cdcId=pgmsascdc&cdcVersion=9.4_3.5&docsetId=caspg&docsetTarget=cas-table-loaddatasource.htm&locale=en,A_loadDataSource0
SAS Visual Analytics,table,loadTable,Loads a table from a caslib's data source,http://documentation.sas.com/?cdcId=pgmsascdc&cdcVersion=9.4_3.5&docsetId=caspg&docsetTarget=cas-table-loadtable.htm&locale=en,A_loadTable1
SAS Visual Analytics,table,partition,Partitions a table,http://documentation.sas.com/?cdcId=pgmsascdc&cdcVersion=9.4_3.5&docsetId=caspg&docsetTarget=cas-table-partition.htm&locale=en,A_partition1
SAS Visual Analytics,table,promote,Promote a table to global scope,http://documentation.sas.com/?cdcId=pgmsascdc&cdcVersion=9.4_3.5&docsetId=caspg&docsetTarget=cas-table-promote.htm&locale=en,A_promote0
SAS Visual Analytics,table,queryCaslib,Checks whether a caslib exists,http://documentation.sas.com/?cdcId=pgmsascdc&cdcVersion=9.4_3.5&docsetId=caspg&docsetTarget=cas-table-querycaslib.htm&locale=en,A_queryCaslib1
SAS Visual Analytics,table,recordCount,Shows the number of rows in a Cloud Analytic Services table,http://documentation.sas.com/?cdcId=pgmsascdc&cdcVersion=9.4_3.5&docsetId=caspg&docsetTarget=cas-table-recordcount.htm&locale=en,A_recordCount2
SAS Visual Analytics,table,save,Saves a table to a caslib's data source,http://documentation.sas.com/?cdcId=pgmsascdc&cdcVersion=9.4_3.5&docsetId=caspg&docsetTarget=cas-table-save.htm&locale=en,A_save1
SAS Visual Analytics,table,shuffle,Randomly shuffles a table,http://documentation.sas.com/?cdcId=pgmsascdc&cdcVersion=9.4_3.5&docsetId=caspg&docsetTarget=cas-table-shuffle.htm&locale=en,A_shuffle1
SAS Visual Analytics,table,tableDetails,Get detailed information about a table,http://documentation.sas.com/?cdcId=pgmsascdc&cdcVersion=9.4_3.5&docsetId=caspg&docsetTarget=cas-table-tabledetails.htm&locale=en,A_tableDetails0
SAS Visual Analytics,table,tableExists,Checks whether a table has been loaded,http://documentation.sas.com/?cdcId=pgmsascdc&cdcVersion=9.4_3.5&docsetId=caspg&docsetTarget=cas-table-tableexists.htm&locale=en,A_tableExists0
SAS Visual Analytics,table,tableInfo,Shows information about a table,http://documentation.sas.com/?cdcId=pgmsascdc&cdcVersion=9.4_3.5&docsetId=caspg&docsetTarget=cas-table-tableinfo.htm&locale=en,A_tableInfo1
SAS Visual Analytics,table,update,Updates rows in a table,http://documentation.sas.com/?cdcId=pgmsascdc&cdcVersion=9.4_3.5&docsetId=caspg&docsetTarget=cas-table-update.htm&locale=en,A_update1
SAS Visual Analytics,table,upload,Transfers binary data to the server to create objects like tables,http://documentation.sas.com/?cdcId=pgmsascdc&cdcVersion=9.4_3.5&docsetId=caspg&docsetTarget=cas-table-upload.htm&locale=en,A_upload4
SAS Visual Analytics,table,view,Creates a view from files or tables,http://documentation.sas.com/?cdcId=pgmsascdc&cdcVersion=9.4_3.5&docsetId=caspg&docsetTarget=cas-table-view.htm&locale=en,A_view0
SAS Visual Analytics,textMining,tmMine,"Combines the tpParse action, the tpAccumulate action, and SVD functionality into one action. Some parameters require a SAS Visual Text Analytics license or a SAS Visual Data Mining and Machine Learning license",http://documentation.sas.com/?cdcId=pgmsascdc&cdcVersion=9.4_3.5&docsetId=casanpg&docsetTarget=cas-textmining-tmmine.htm&locale=en,A_tmMine3
SAS Visual Analytics,textMining,tmScore,Generates the parent table and SVD projections from new textual data based on the results from previous training data. This action requires a SAS Visual Text Analytics license or a SAS Visual Data Mining and Machine Learning license,http://documentation.sas.com/?cdcId=pgmsascdc&cdcVersion=9.4_3.5&docsetId=casanpg&docsetTarget=cas-textmining-tmscore.htm&locale=en,A_tmScore1
SAS Visual Analytics,textMining,tmSvd,Computes the SVD factorization and generates topics. This action requires a SAS Visual Text Analytics license or a SAS Visual Data Mining and Machine Learning license,http://documentation.sas.com/?cdcId=pgmsascdc&cdcVersion=9.4_3.5&docsetId=casanpg&docsetTarget=cas-textmining-tmsvd.htm&locale=en,A_tmSvd3
SAS Visual Analytics,transpose,transpose,"Create an output table by restructuring the values in a table, transposing data from input rows to output columns",http://documentation.sas.com/?cdcId=pgmsascdc&cdcVersion=9.4_3.5&docsetId=caspg&docsetTarget=cas-transpose-transpose.htm&locale=en,A_transpose2
SAS Visual Statistics,accessControl,accessPersonalCaslibs,Provides administrative access to all personal caslibs (CASUSER and CASUSERHDFS),http://documentation.sas.com/?cdcId=pgmsascdc&cdcVersion=9.4_3.5&docsetId=caspg&docsetTarget=cas-accesscontrol-accesspersonalcaslibs.htm&locale=en,A_accessPersonalCaslibs0
SAS Visual Statistics,accessControl,assumeRole,Assumes a role,http://documentation.sas.com/?cdcId=pgmsascdc&cdcVersion=9.4_3.5&docsetId=caspg&docsetTarget=cas-accesscontrol-assumerole.htm&locale=en,A_assumeRole1
SAS Visual Statistics,accessControl,checkInAllObjects,Releases all objects that are checked out. Use this action if the current client session does not have a transaction,http://documentation.sas.com/?cdcId=pgmsascdc&cdcVersion=9.4_3.5&docsetId=caspg&docsetTarget=cas-accesscontrol-checkinallobjects.htm&locale=en,A_checkInAllObjects1
SAS Visual Statistics,accessControl,checkOutObject,Reserves an object (and all of its children) for update by only the current client session. Prevents an object (and all of its parents) from being checked out exclusively by another session if checkOutType=Shared,http://documentation.sas.com/?cdcId=pgmsascdc&cdcVersion=9.4_3.5&docsetId=caspg&docsetTarget=cas-accesscontrol-checkoutobject.htm&locale=en,A_checkOutObject0
SAS Visual Statistics,accessControl,commitTransaction,"Persists all changes in an access control transaction to the server, releases all checked-out objects, and terminates the transaction",http://documentation.sas.com/?cdcId=pgmsascdc&cdcVersion=9.4_3.5&docsetId=caspg&docsetTarget=cas-accesscontrol-committransaction.htm&locale=en,A_commitTransaction1
SAS Visual Statistics,accessControl,completeBackup,Flags a backup as complete,http://documentation.sas.com/?cdcId=pgmsascdc&cdcVersion=9.4_3.5&docsetId=caspg&docsetTarget=cas-accesscontrol-completebackup.htm&locale=en,A_completeBackup2
SAS Visual Statistics,accessControl,createBackup,Creates a backup if one is not in progress,http://documentation.sas.com/?cdcId=pgmsascdc&cdcVersion=9.4_3.5&docsetId=caspg&docsetTarget=cas-accesscontrol-createbackup.htm&locale=en,A_createBackup2
SAS Visual Statistics,accessControl,deleteBWList,Deletes a blacklist or a whitelist,http://documentation.sas.com/?cdcId=pgmsascdc&cdcVersion=9.4_3.5&docsetId=caspg&docsetTarget=cas-accesscontrol-deletebwlist.htm&locale=en,A_deleteBWList1
SAS Visual Statistics,accessControl,dropRole,Relinquishes a role,http://documentation.sas.com/?cdcId=pgmsascdc&cdcVersion=9.4_3.5&docsetId=caspg&docsetTarget=cas-accesscontrol-droprole.htm&locale=en,A_dropRole1
SAS Visual Statistics,accessControl,isAuthorized,Shows whether access is authorized,http://documentation.sas.com/?cdcId=pgmsascdc&cdcVersion=9.4_3.5&docsetId=caspg&docsetTarget=cas-accesscontrol-isauthorized.htm&locale=en,A_isAuthorized1
SAS Visual Statistics,accessControl,isAuthorizedActions,Shows whether access is authorized to actions,http://documentation.sas.com/?cdcId=pgmsascdc&cdcVersion=9.4_3.5&docsetId=caspg&docsetTarget=cas-accesscontrol-isauthorizedactions.htm&locale=en,A_isAuthorizedActions1
SAS Visual Statistics,accessControl,isAuthorizedColumns,Shows whether access is authorized to columns,http://documentation.sas.com/?cdcId=pgmsascdc&cdcVersion=9.4_3.5&docsetId=caspg&docsetTarget=cas-accesscontrol-isauthorizedcolumns.htm&locale=en,A_isAuthorizedColumns2
SAS Visual Statistics,accessControl,isAuthorizedTables,Shows whether access is authorized to tables,http://documentation.sas.com/?cdcId=pgmsascdc&cdcVersion=9.4_3.5&docsetId=caspg&docsetTarget=cas-accesscontrol-isauthorizedtables.htm&locale=en,A_isAuthorizedTables0
SAS Visual Statistics,accessControl,isInRole,Shows whether a role is assumed,http://documentation.sas.com/?cdcId=pgmsascdc&cdcVersion=9.4_3.5&docsetId=caspg&docsetTarget=cas-accesscontrol-isinrole.htm&locale=en,A_isInRole1
SAS Visual Statistics,accessControl,listAcsActionSet,Lists access controls for an action or action set,http://documentation.sas.com/?cdcId=pgmsascdc&cdcVersion=9.4_3.5&docsetId=caspg&docsetTarget=cas-accesscontrol-listacsactionset.htm&locale=en,A_listAcsActionSet2
SAS Visual Statistics,accessControl,listAcsData,"Lists access controls for caslibs, tables, and columns",http://documentation.sas.com/?cdcId=pgmsascdc&cdcVersion=9.4_3.5&docsetId=caspg&docsetTarget=cas-accesscontrol-listacsdata.htm&locale=en,A_listAcsData2
SAS Visual Statistics,accessControl,listAllPrincipals,Lists all principals that have explicit access controls,http://documentation.sas.com/?cdcId=pgmsascdc&cdcVersion=9.4_3.5&docsetId=caspg&docsetTarget=cas-accesscontrol-listallprincipals.htm&locale=en,A_listAllPrincipals0
SAS Visual Statistics,accessControl,listMetadata,"Lists the metadata for caslibs, tables, columns, action sets, actions, or administrators",http://documentation.sas.com/?cdcId=pgmsascdc&cdcVersion=9.4_3.5&docsetId=caspg&docsetTarget=cas-accesscontrol-listmetadata.htm&locale=en,A_listMetadata1
SAS Visual Statistics,accessControl,operActionMd,"Adds, deletes, and modifies action metadata",http://documentation.sas.com/?cdcId=pgmsascdc&cdcVersion=9.4_3.5&docsetId=caspg&docsetTarget=cas-accesscontrol-operactionmd.htm&locale=en,A_operActionMd0
SAS Visual Statistics,accessControl,operActionSetMd,"Adds, deletes, and modifies action set metadata",http://documentation.sas.com/?cdcId=pgmsascdc&cdcVersion=9.4_3.5&docsetId=caspg&docsetTarget=cas-accesscontrol-operactionsetmd.htm&locale=en,A_operActionSetMd2
SAS Visual Statistics,accessControl,operAdminMd,Assigns users and groups to roles and modifies administrator metadata,http://documentation.sas.com/?cdcId=pgmsascdc&cdcVersion=9.4_3.5&docsetId=caspg&docsetTarget=cas-accesscontrol-operadminmd.htm&locale=en,A_operAdminMd2
SAS Visual Statistics,accessControl,operBWPaths,Configures a blacklist or whitelist of paths,http://documentation.sas.com/?cdcId=pgmsascdc&cdcVersion=9.4_3.5&docsetId=caspg&docsetTarget=cas-accesscontrol-operbwpaths.htm&locale=en,A_operBWPaths2
SAS Visual Statistics,accessControl,operColumnMd,"Adds, deletes, and modifies column metadata",http://documentation.sas.com/?cdcId=pgmsascdc&cdcVersion=9.4_3.5&docsetId=caspg&docsetTarget=cas-accesscontrol-opercolumnmd.htm&locale=en,A_operColumnMd1
SAS Visual Statistics,accessControl,operTableMd,"Adds, deletes, and modifies table metadata",http://documentation.sas.com/?cdcId=pgmsascdc&cdcVersion=9.4_3.5&docsetId=caspg&docsetTarget=cas-accesscontrol-opertablemd.htm&locale=en,A_operTableMd0
SAS Visual Statistics,accessControl,remAllAcsActionSet,Removes all access controls for an action set or action,http://documentation.sas.com/?cdcId=pgmsascdc&cdcVersion=9.4_3.5&docsetId=caspg&docsetTarget=cas-accesscontrol-remallacsactionset.htm&locale=en,A_remAllAcsActionSet2
SAS Visual Statistics,accessControl,remAllAcsData,"Removes all access controls for a caslib, table, or column",http://documentation.sas.com/?cdcId=pgmsascdc&cdcVersion=9.4_3.5&docsetId=caspg&docsetTarget=cas-accesscontrol-remallacsdata.htm&locale=en,A_remAllAcsData2
SAS Visual Statistics,accessControl,repAllAcsAction,Replaces all access controls for an action,http://documentation.sas.com/?cdcId=pgmsascdc&cdcVersion=9.4_3.5&docsetId=caspg&docsetTarget=cas-accesscontrol-repallacsaction.htm&locale=en,A_repAllAcsAction0
SAS Visual Statistics,accessControl,repAllAcsActionSet,Replaces all access controls for an action set,http://documentation.sas.com/?cdcId=pgmsascdc&cdcVersion=9.4_3.5&docsetId=caspg&docsetTarget=cas-accesscontrol-repallacsactionset.htm&locale=en,A_repAllAcsActionSet0
SAS Visual Statistics,accessControl,repAllAcsCaslib,Replaces all access controls for a caslib,http://documentation.sas.com/?cdcId=pgmsascdc&cdcVersion=9.4_3.5&docsetId=caspg&docsetTarget=cas-accesscontrol-repallacscaslib.htm&locale=en,A_repAllAcsCaslib2
SAS Visual Statistics,accessControl,repAllAcsColumn,Replaces all access controls for a column,http://documentation.sas.com/?cdcId=pgmsascdc&cdcVersion=9.4_3.5&docsetId=caspg&docsetTarget=cas-accesscontrol-repallacscolumn.htm&locale=en,A_repAllAcsColumn2
SAS Visual Statistics,accessControl,repAllAcsTable,Replaces all access controls for a table,http://documentation.sas.com/?cdcId=pgmsascdc&cdcVersion=9.4_3.5&docsetId=caspg&docsetTarget=cas-accesscontrol-repallacstable.htm&locale=en,A_repAllAcsTable2
SAS Visual Statistics,accessControl,rollbackTransaction,"Discards all changes in an access control transaction, releases all checked-out objects, and terminates the transaction",http://documentation.sas.com/?cdcId=pgmsascdc&cdcVersion=9.4_3.5&docsetId=caspg&docsetTarget=cas-accesscontrol-rollbacktransaction.htm&locale=en,A_rollbackTransaction0
SAS Visual Statistics,accessControl,showRolesAllowed,Shows the roles that a user is a member of,http://documentation.sas.com/?cdcId=pgmsascdc&cdcVersion=9.4_3.5&docsetId=caspg&docsetTarget=cas-accesscontrol-showrolesallowed.htm&locale=en,A_showRolesAllowed2
SAS Visual Statistics,accessControl,showRolesIn,Shows the currently active role,http://documentation.sas.com/?cdcId=pgmsascdc&cdcVersion=9.4_3.5&docsetId=caspg&docsetTarget=cas-accesscontrol-showrolesin.htm&locale=en,A_showRolesIn2
SAS Visual Statistics,accessControl,startTransaction,"Initiates an access control transaction in the current client session. Within a transaction, changes are private. Within a transaction, only exclusively reserved (checked-out) objects and their children can be updated. A transaction terminates when it is committed or rolled back",http://documentation.sas.com/?cdcId=pgmsascdc&cdcVersion=9.4_3.5&docsetId=caspg&docsetTarget=cas-accesscontrol-starttransaction.htm&locale=en,A_startTransaction1
SAS Visual Statistics,accessControl,statusTransaction,Shows whether client session has an active transaction,http://documentation.sas.com/?cdcId=pgmsascdc&cdcVersion=9.4_3.5&docsetId=caspg&docsetTarget=cas-accesscontrol-statustransaction.htm&locale=en,A_statusTransaction1
SAS Visual Statistics,accessControl,updSomeAcsAction,"Adds, deletes, and modifies some access controls for an action",http://documentation.sas.com/?cdcId=pgmsascdc&cdcVersion=9.4_3.5&docsetId=caspg&docsetTarget=cas-accesscontrol-updsomeacsaction.htm&locale=en,A_updSomeAcsAction1
SAS Visual Statistics,accessControl,updSomeAcsActionSet,"Adds, deletes, and modifies some access controls for an action set",http://documentation.sas.com/?cdcId=pgmsascdc&cdcVersion=9.4_3.5&docsetId=caspg&docsetTarget=cas-accesscontrol-updsomeacsactionset.htm&locale=en,A_updSomeAcsActionSet0
SAS Visual Statistics,accessControl,updSomeAcsCaslib,"Adds, deletes, and modifies some access controls for a caslib",http://documentation.sas.com/?cdcId=pgmsascdc&cdcVersion=9.4_3.5&docsetId=caspg&docsetTarget=cas-accesscontrol-updsomeacscaslib.htm&locale=en,A_updSomeAcsCaslib2
SAS Visual Statistics,accessControl,updSomeAcsColumn,"Adds, deletes, and modifies some access controls for a column",http://documentation.sas.com/?cdcId=pgmsascdc&cdcVersion=9.4_3.5&docsetId=caspg&docsetTarget=cas-accesscontrol-updsomeacscolumn.htm&locale=en,A_updSomeAcsColumn1
SAS Visual Statistics,accessControl,updSomeAcsTable,"Adds, deletes, and modifies some access controls for a table",http://documentation.sas.com/?cdcId=pgmsascdc&cdcVersion=9.4_3.5&docsetId=caspg&docsetTarget=cas-accesscontrol-updsomeacstable.htm&locale=en,A_updSomeAcsTable2
SAS Visual Statistics,accessControl,whatCheckoutsExist,"Lists checkouts held on an object, its parents, and optionally its children",http://documentation.sas.com/?cdcId=pgmsascdc&cdcVersion=9.4_3.5&docsetId=caspg&docsetTarget=cas-accesscontrol-whatcheckoutsexist.htm&locale=en,A_whatCheckoutsExist1
SAS Visual Statistics,accessControl,whatIsEffective,Lists effective access and explanations (Origins),http://documentation.sas.com/?cdcId=pgmsascdc&cdcVersion=9.4_3.5&docsetId=caspg&docsetTarget=cas-accesscontrol-whatiseffective.htm&locale=en,A_whatIsEffective1
SAS Visual Statistics,aggregation,aggregate,Performs aggregation on selected variables,http://documentation.sas.com/?cdcId=pgmsascdc&cdcVersion=9.4_3.5&docsetId=casanpg&docsetTarget=cas-aggregation-aggregate.htm&locale=en,A_aggregate2
SAS Visual Statistics,builtins,actionSetFromTable,Restores a user-defined action set from a saved table,http://documentation.sas.com/?cdcId=pgmsascdc&cdcVersion=9.4_3.5&docsetId=caspg&docsetTarget=cas-builtins-actionsetfromtable.htm&locale=en,A_actionSetFromTable2
SAS Visual Statistics,builtins,actionSetInfo,Shows the build information from loaded action sets,http://documentation.sas.com/?cdcId=pgmsascdc&cdcVersion=9.4_3.5&docsetId=caspg&docsetTarget=cas-builtins-actionsetinfo.htm&locale=en,A_actionSetInfo1
SAS Visual Statistics,builtins,actionSetToTable,Makes an in-memory table from a user-defined action set,http://documentation.sas.com/?cdcId=pgmsascdc&cdcVersion=9.4_3.5&docsetId=caspg&docsetTarget=cas-builtins-actionsettotable.htm&locale=en,A_actionSetToTable0
SAS Visual Statistics,builtins,addNode,Adds a machine to the server,http://documentation.sas.com/?cdcId=pgmsascdc&cdcVersion=9.4_3.5&docsetId=caspg&docsetTarget=cas-builtins-addnode.htm&locale=en,A_addNode1
SAS Visual Statistics,builtins,defineActionSet,Defines a new user-defined action set,http://documentation.sas.com/?cdcId=pgmsascdc&cdcVersion=9.4_3.5&docsetId=caspg&docsetTarget=cas-builtins-defineactionset.htm&locale=en,A_defineActionSet1
SAS Visual Statistics,builtins,describeActionSet,Describes a user-defined action set,http://documentation.sas.com/?cdcId=pgmsascdc&cdcVersion=9.4_3.5&docsetId=caspg&docsetTarget=cas-builtins-describeactionset.htm&locale=en,A_describeActionSet2
SAS Visual Statistics,builtins,dropActionSet,Drops a user-defined action set,http://documentation.sas.com/?cdcId=pgmsascdc&cdcVersion=9.4_3.5&docsetId=caspg&docsetTarget=cas-builtins-dropactionset.htm&locale=en,A_dropActionSet2
SAS Visual Statistics,builtins,echo,Prints the supplied parameters to the client log,http://documentation.sas.com/?cdcId=pgmsascdc&cdcVersion=9.4_3.5&docsetId=caspg&docsetTarget=cas-builtins-echo.htm&locale=en,A_echo1
SAS Visual Statistics,builtins,getCacheInfo,Retrieves info about CAS_DISK_CACHE usage on session worker nodes,http://documentation.sas.com/?cdcId=pgmsascdc&cdcVersion=9.4_3.5&docsetId=caspg&docsetTarget=cas-builtins-getcacheinfo.htm&locale=en,A_getCacheInfo0
SAS Visual Statistics,builtins,getLicenseInfo,Shows the license information for a SAS product,http://documentation.sas.com/?cdcId=pgmsascdc&cdcVersion=9.4_3.5&docsetId=caspg&docsetTarget=cas-builtins-getlicenseinfo.htm&locale=en,A_getLicenseInfo2
SAS Visual Statistics,builtins,getLicensedProductInfo,Shows the information for licensed SAS products,http://documentation.sas.com/?cdcId=pgmsascdc&cdcVersion=9.4_3.5&docsetId=caspg&docsetTarget=cas-builtins-getlicensedproductinfo.htm&locale=en,A_getLicensedProductInfo2
SAS Visual Statistics,builtins,help,Shows the parameters for an action or lists all available actions,http://documentation.sas.com/?cdcId=pgmsascdc&cdcVersion=9.4_3.5&docsetId=caspg&docsetTarget=cas-builtins-help.htm&locale=en,A_help2
SAS Visual Statistics,builtins,history,Shows the actions that were run in this session,http://documentation.sas.com/?cdcId=pgmsascdc&cdcVersion=9.4_3.5&docsetId=caspg&docsetTarget=cas-builtins-history.htm&locale=en,A_history2
SAS Visual Statistics,builtins,httpAddress,Shows the HTTP address for the server monitor,http://documentation.sas.com/?cdcId=pgmsascdc&cdcVersion=9.4_3.5&docsetId=caspg&docsetTarget=cas-builtins-httpaddress.htm&locale=en,A_httpAddress2
SAS Visual Statistics,builtins,installActionSet,Loads an action set in new sessions automatically,http://documentation.sas.com/?cdcId=pgmsascdc&cdcVersion=9.4_3.5&docsetId=caspg&docsetTarget=cas-builtins-installactionset.htm&locale=en,A_installActionSet2
SAS Visual Statistics,builtins,listNodes,Shows the host names used by the server,http://documentation.sas.com/?cdcId=pgmsascdc&cdcVersion=9.4_3.5&docsetId=caspg&docsetTarget=cas-builtins-listnodes.htm&locale=en,A_listNodes2
SAS Visual Statistics,builtins,loadActionSet,Loads an action set for use in this session,http://documentation.sas.com/?cdcId=pgmsascdc&cdcVersion=9.4_3.5&docsetId=caspg&docsetTarget=cas-builtins-loadactionset.htm&locale=en,A_loadActionSet2
SAS Visual Statistics,builtins,log,Shows and modifies logging levels,http://documentation.sas.com/?cdcId=pgmsascdc&cdcVersion=9.4_3.5&docsetId=caspg&docsetTarget=cas-builtins-log.htm&locale=en,A_log2
SAS Visual Statistics,builtins,modifyQueue,Modifies the action response queue settings,http://documentation.sas.com/?cdcId=pgmsascdc&cdcVersion=9.4_3.5&docsetId=caspg&docsetTarget=cas-builtins-modifyqueue.htm&locale=en,A_modifyQueue0
SAS Visual Statistics,builtins,ping,Sends a single request to the server to confirm that the connection is working,http://documentation.sas.com/?cdcId=pgmsascdc&cdcVersion=9.4_3.5&docsetId=caspg&docsetTarget=cas-builtins-ping.htm&locale=en,A_ping0
SAS Visual Statistics,builtins,queryActionSet,Shows whether an action set is loaded,http://documentation.sas.com/?cdcId=pgmsascdc&cdcVersion=9.4_3.5&docsetId=caspg&docsetTarget=cas-builtins-queryactionset.htm&locale=en,A_queryActionSet2
SAS Visual Statistics,builtins,queryName,Checks whether a name is an action or action set name,http://documentation.sas.com/?cdcId=pgmsascdc&cdcVersion=9.4_3.5&docsetId=caspg&docsetTarget=cas-builtins-queryname.htm&locale=en,A_queryName2
SAS Visual Statistics,builtins,reflect,Shows detailed parameter information for an action or all actions in an action set,http://documentation.sas.com/?cdcId=pgmsascdc&cdcVersion=9.4_3.5&docsetId=caspg&docsetTarget=cas-builtins-reflect.htm&locale=en,A_reflect1
SAS Visual Statistics,builtins,refreshLicense,Refresh SAS license information from a file,http://documentation.sas.com/?cdcId=pgmsascdc&cdcVersion=9.4_3.5&docsetId=caspg&docsetTarget=cas-builtins-refreshlicense.htm&locale=en,A_refreshLicense2
SAS Visual Statistics,builtins,removeNode,Remove one or more machines from the server,http://documentation.sas.com/?cdcId=pgmsascdc&cdcVersion=9.4_3.5&docsetId=caspg&docsetTarget=cas-builtins-removenode.htm&locale=en,A_removeNode2
SAS Visual Statistics,builtins,serverStatus (about),Shows the status of the server,http://documentation.sas.com/?cdcId=pgmsascdc&cdcVersion=9.4_3.5&docsetId=caspg&docsetTarget=cas-builtins-serverstatus.htm&locale=en,A_serverStatus (about)2
SAS Visual Statistics,builtins,shutdown,Shuts down the server,http://documentation.sas.com/?cdcId=pgmsascdc&cdcVersion=9.4_3.5&docsetId=caspg&docsetTarget=cas-builtins-shutdown.htm&locale=en,A_shutdown2
SAS Visual Statistics,builtins,userInfo,Shows the user information for your connection,http://documentation.sas.com/?cdcId=pgmsascdc&cdcVersion=9.4_3.5&docsetId=caspg&docsetTarget=cas-builtins-userinfo.htm&locale=en,A_userInfo0
SAS Visual Statistics,cardinality,summarize,Provides actions for evaluating data cardinality,http://documentation.sas.com/?cdcId=pgmsascdc&cdcVersion=9.4_3.5&docsetId=casactstat&docsetTarget=cas-cardinality-summarize.htm&locale=en,A_summarize0
SAS Visual Statistics,sccasl,runCasl,Runs CASL code,http://documentation.sas.com/?cdcId=pgmsascdc&cdcVersion=9.4_3.5&docsetId=caspg&docsetTarget=cas-sccasl-runcasl.htm&locale=en,A_runCasl0
SAS Visual Statistics,clustering,kClus,Provides k-means clustering,http://documentation.sas.com/?cdcId=pgmsascdc&cdcVersion=9.4_3.5&docsetId=casactstat&docsetTarget=cas-clustering-kclus.htm&locale=en,A_kClus0
SAS Visual Statistics,dataPreprocess,binning,Performs unsupervised variable discretization,http://documentation.sas.com/?cdcId=pgmsascdc&cdcVersion=9.4_3.5&docsetId=casanpg&docsetTarget=cas-datapreprocess-binning.htm&locale=en,A_binning1
SAS Visual Statistics,dataPreprocess,catTrans,Groups and encodes categorical variables using unsupervised and supervised grouping techniques,http://documentation.sas.com/?cdcId=pgmsascdc&cdcVersion=9.4_3.5&docsetId=casanpg&docsetTarget=cas-datapreprocess-cattrans.htm&locale=en,A_catTrans2
SAS Visual Statistics,dataPreprocess,discretize,Performs supervised and unsupervised variable discretization,http://documentation.sas.com/?cdcId=pgmsascdc&cdcVersion=9.4_3.5&docsetId=casanpg&docsetTarget=cas-datapreprocess-discretize.htm&locale=en,A_discretize2
SAS Visual Statistics,dataPreprocess,highCardinality,Performs randomized cardinality estimation,http://documentation.sas.com/?cdcId=pgmsascdc&cdcVersion=9.4_3.5&docsetId=casanpg&docsetTarget=cas-datapreprocess-highcardinality.htm&locale=en,A_highCardinality2
SAS Visual Statistics,dataPreprocess,histogram,Generates histogram bins and simple bin-based statistics for numeric variables,http://documentation.sas.com/?cdcId=pgmsascdc&cdcVersion=9.4_3.5&docsetId=casanpg&docsetTarget=cas-datapreprocess-histogram.htm&locale=en,A_histogram2
